title,posted_by,posted,send_before,budget,desc,tags,url
wordpress developer css expert,Pawan K,on Feb 29,"Mar 30, 2020","Fixed Price , $2.5k-$5k",I need a Wordpress developer having experience with make CSS changes in WordPress theme.should start today!long term work!,"CSS, WordPress, E Commerce, Templates / Wireframes / Mockups, Domains / Hosting / Maintenance / Security",https://www.guru.com/jobs/wordpress-developer-css-expert/1636113&SearchUrl=search.aspx?
Full-stack Ruby on Rails Developers,Mustafa E,on Feb 29,"Mar 30, 2020","Hourly , $2 - $15","Job DescriptionWe’re looking for a full-stack Ruby on Rails developer to join our team and help us build out the features, add new blockchain to website.Who Will You Be Working With?You’ll be working …","Programming, Ruby On Rails, Cryptocurrency, Blockchain, Unix / Linux",https://www.guru.com/jobs/full-stack-ruby-on-rails-developers/1636089&SearchUrl=search.aspx?
Animated GIFs Designer (part time),AMEYA SUMERU I,on Feb 28,"Mar 29, 2020","Hourly , No Rate specified , 1-10 Hours/wk","HiASI PVT LTD is looking for a part-time animated gifs designer ( 3$ to 5$ ) per animated gif, It involves free sketch and converted to HTML5 and repeating animated gif.we may have 1000's of them goin…","2D Animation, HTML5, Logo Animation, GIF, GIF Animation, Sketch Software",https://www.guru.com/jobs/animated-gifs-designer-part-time-/1635772&SearchUrl=search.aspx?
CSS and jQuery expert,Hiring P,on Feb 27,"Mar 28, 2020","Fixed Price , Under $250",I need a CSS and jQuery expert now.,"CSS, jQuery",https://www.guru.com/jobs/css-and-jquery-expert/1635242&SearchUrl=search.aspx?
"Dynamic Record Update: Ajax, Php, Html",Cumhur T,on Feb 26,"Mar 27, 2020","Fixed Price , Under $250",www.my-eye.bizSite is in Laravel php frame Budget is $80and time frame is 2 business daysFull Description:If a new record is posted or an existing one is deleted by the user than I want these changes …,"HTML, Java, PHP, Ajax, AJAX Framework, Laravel",https://www.guru.com/jobs/dynamic-record-update-ajax-php-html/1635121&SearchUrl=search.aspx?
Construct 2 small electronic circuits,Ray B,on Feb 25,"Mar 26, 2020","Fixed Price , Under $250",Construct 2 copies of 2 audio electronic circuits.See attached circuit diagrams and this web forum:https://www.diyaudio.com/forums/solid-state/176373-fix-audio-research-110-modules-5.html,"Electrical, Circuits",https://www.guru.com/jobs/construct-2-small-electronic-circuits/1634661&SearchUrl=search.aspx?
Drupal Development,Nathan W,on Feb 24,"Mar 25, 2020","Hourly , $30 - $30",Adding custom css stylingRestructuring a drupal layout.,Drupal,https://www.guru.com/jobs/drupal-development/1634483&SearchUrl=search.aspx?
develop admin panel with full crud,Augusto S,on Feb 24,"Mar 25, 2020","Fixed Price , $250-$500","The developer will have to create using the technologies (Javascript, html5, css, firebase or mysql) or we can use some Bootstrap theme. The important thing is to have a beautiful and functional manag…","HTML, JavaScript, MySQL, CSS, HTML5, Node.js, Back End Development, Front End Development, General / Other Web Development, UX / UI / Responsive",https://www.guru.com/jobs/develop-admin-panel-with-full-crud/1634474&SearchUrl=search.aspx?
HTML post from Unity project,VJ C,on Feb 24,"Mar 25, 2020","Fixed Price , Under $250",HelloWe need to post and get data into our Unity project.We would like to use post and get to our AWS HTTP Server.We need top implement this as simply as possible.,"HTML, Unity 3D",https://www.guru.com/jobs/html-post-from-unity-project/1634464&SearchUrl=search.aspx?
Magento FullStack Developer,Martin R,on Feb 24,"Mar 25, 2020","Hourly , $20 - $40",Bing Digital works closely with retailers and emerging brands to deliver complex e-commerce sites on the Magento Community & Enterprise platform. We have worked with Magento since 2009 and have a pres…,"PHP, Web Servers, E Commerce, PHP Framework, Back End Development, Front End Development",https://www.guru.com/jobs/magento-fullstack-developer/1634432&SearchUrl=search.aspx?
Web Developer,LinPing J,on Feb 23,"Mar 24, 2020","Fixed Price , $500-$1k",Hi GurusThis is urgently job.I have one living site.Please review this site.http://sharemycoach.comIt has some bad web design and small bugs.So I am looking for a web developer that can fix these issu…,"HTML, Java, SQL, jQuery, Web Design, Web Development",https://www.guru.com/jobs/web-developer/1634142&SearchUrl=search.aspx?
react web development  for social networ,chait r,on Feb 22,"Mar 23, 2020","Hourly , $5 - $13","We have a fully defined UI in Avocode and Xd. You can get the CSS for all the elements and the layout in the dashboard. We have several pages , dialog boxes, forms that are all well designed. We need …","User Interface Design, Web Development, Front End Development, React Native, UX / UI / Responsive",https://www.guru.com/jobs/react-web-development-for-social-networ/1633878&SearchUrl=search.aspx?
fix yii2 issue,amro a,on Feb 22,"Mar 23, 2020","Fixed Price , Under $250",Goal:              I need to convert the html to image.Goal Solution :  I use Canvas to convert the html to image using JavaScript. Canva convert and return the image in base64 format.problem:  I need…,"",https://www.guru.com/jobs/fix-yii2-issue/1633794&SearchUrl=search.aspx?
telemedicine developer,zohra s,on Feb 22,"Mar 23, 2020","Fixed Price , $5k-$10k","JOB DESCRIPTION:  SOFTWARE DEVELOPER for immediate hire, after 30-min interview.  Seeking software developer with a degree in Computer Science, Information Technology or have equivalent work related e…","Java, App & Mobile Marketing, App & Mobile Programming Languages",https://www.guru.com/jobs/telemedicine-developer/1633752&SearchUrl=search.aspx?
Single page web app (responsive),Noah F,on Feb 21,"Mar 22, 2020","Fixed Price , $250-$500","I need a single page website built, and need it to be top quality:- Must be responsive- Use latest standards - CSS3 / HTML5 - Optimized for web / mobile / SEO","",https://www.guru.com/jobs/single-page-web-app-responsive-/1633582&SearchUrl=search.aspx?
Build a complete cloud based Website,Gary - S,on Feb 21,"Mar 22, 2020",Fixed Price or Hourly,"Need someone to build a complete cloud based marketing website, such as in Cloud Pages, Cartflows, or similar, complete with landing pages,up-sell and down-sell pages, e-mail tracking, with site admin…","CSS, Advertising Management, Digital, Marketing, Promotions, SEO, Web Development, Landing Page Design, Sales Page, Advertising Campaigns, Bulk Mailings & Lists, Advertising Ideas",https://www.guru.com/jobs/build-a-complete-cloud-based-website/1633534&SearchUrl=search.aspx?
"stocking web store, zen cart",Paul A,on Feb 21,"Mar 22, 2020",Fixed Price or Hourly,"I'm looking for a trustworthy, reliable person to use to stock products in a zen shopping cart. You need to have web design software to put it into html, know how to resize pictures and if need be, ma…","Zen Cart, Design",https://www.guru.com/jobs/stocking-web-store-zen-cart/1633359&SearchUrl=search.aspx?
UI/UX Engineer,Muhammad P,on Feb 21,"Mar 21, 2020",Fixed Price or Hourly,"3-5 year relevant experience;ü  Hands-on experience creating wireframes, prototypes, storyboards, user flows, etc.;ü  Experience using tools such as Photoshop, Sketch, Corel Draw, Illustrator, Creativ…",User Experience Design,https://www.guru.com/jobs/ui-ux-engineer/1633297&SearchUrl=search.aspx?
Moodle Developer,Muhammad P,on Feb 21,"Mar 21, 2020",Fixed Price or Hourly,"Moodle DeveloperMinimum 4 years’ experience in a professional Moodle (PHP) development environment;ü  Extensive knowledge of PHP 5, MySQL 5, Apache 2 and Linux, Ubuntu experience preferred;ü  Programm…",Database Development,https://www.guru.com/jobs/moodle-developer/1633298&SearchUrl=search.aspx?
Full Stack Dev,Josh E,on Feb 20,"Mar 21, 2020","Hourly , No Rate specified , 10-30 Hours/wk","We are small team looking to add to our Laravel/PHP software/ front end engineer. Laravel (PHP framework list) need to have experience with PostgresSQL (LAMP architecture structure), mysql, apache, ng…","Web Development, PHP Framework, Back End Development, Front End Development",https://www.guru.com/jobs/full-stack-dev/1633150&SearchUrl=search.aspx?
need a designer to designing a game site,Anuja D,on Feb 20,"Mar 21, 2020",Fixed Price or Hourly,"I  want to develope a  game site,  i  have already the design, just the designer needs to develope it by adobe flash or html, i will discuss in details once i select you.I have attached the design below.","HTML, Game Design, Gaming, Flash Design, Adobe Flash, Design & Art",https://www.guru.com/jobs/need-a-designer-to-designing-a-game-site/1633113&SearchUrl=search.aspx?
PHP Developer with Laravel Framework,Sk B,on Feb 20,"Mar 21, 2020",Fixed Price or Hourly,"Must be proficient in PHP, MySQL, CSS, HTML, Javascript, Jquery, AJAX, XML, JSON.- Should have experience with Laravel.- Must have the capacity to work independently and also as a part of a team.- Must have dedication and commitment towards work.","HTML, JavaScript, MySQL, CSS, Ajax, JSON, jQuery",https://www.guru.com/jobs/php-developer-with-laravel-framework/1632958&SearchUrl=search.aspx?
I need psd to html expert,Curtis B,on Feb 19,"Mar 20, 2020","Fixed Price , $250-$500","I have my dashboard psd file. want to convert html.If you show me perfect work, will give you my all sites want long term partnership.thx","HTML, PSD to HTML, UX / UI / Responsive",https://www.guru.com/jobs/i-need-psd-to-html-expert/1632787&SearchUrl=search.aspx?
Web-app prototyping: data visualization,"KEWAZO GmbH, DE318055119,  Ekaterina G",on Feb 19,"Mar 20, 2020","Fixed Price , $2.5k-$5k",• Requirements Engineering: Review of requirements and inspection of data formats etc.• Replication of mock-ups into a web- app• Web design according to style guide• Defining APIs for backend• Implementation of backend API and data retrieval,"CSS, Javas, Qlite",https://www.guru.com/jobs/web-app-prototyping-data-visualization/1632677&SearchUrl=search.aspx?
Frontend developer needed for Ruby rails,Ieva O,on Feb 19,"Mar 20, 2020","Fixed Price , Under $250",Existing Ruby and Rails site multiple current pages (front end Html/Css rails erb) needs to be updated. New design psd files will be provided.  The website is built on Ruby and Rails and managed via A…,"HTML, CSS, Design, Ruby On Rails, Amazon AWS, Back End Development, Front End Development, UX / UI / Responsive",https://www.guru.com/jobs/frontend-developer-needed-for-ruby-rails/1632616&SearchUrl=search.aspx?
Senior Full Stack Engineer,Jeff S,on Feb 18,"Mar 19, 2020",Fixed Price,"Senior Full Stack Engineer DESCRIPTIONAbout UsDiscourse.ai is a rapidly growing ML & AI company headquartered in Dallas, TX.  Our Cognition platform dramatically speeds time to value for conversationa…","JavaScript, XML, SQL, API, JSON, Open Source, Database Development, Natural Language Processing, Programming, Software Development, Software Testing, Version Control, Artificial Intelligence, Cloud Computing, Microservices, Object-oriented, General / Other Programming & Software, Graphics / Virtual Reality / AI, Parsing / Data Extraction",https://www.guru.com/jobs/senior-full-stack-engineer/1632510&SearchUrl=search.aspx?
Modify Existing Smarty Php Website,S D,on Feb 18,"Apr 17, 2020",Fixed Price or Hourly,Hello I am looking for a skilled web developer/ php expert to assist in me in updating/modifying my existing custom website. The website I need assistance with  was built using Smarty Framework php Te…,"PHP, MySQL, English, Programming, Web Development, PHP Framework",https://www.guru.com/jobs/modify-existing-smarty-php-website/1632484&SearchUrl=search.aspx?
Facebook Game App from Flash to HTML,Susie L B,on Feb 18,"Mar 19, 2020","Fixed Price , $1k-$2.5k",We have an existing Keno Game App on Facebook that is FlashWe are looking to upgrade the App to HTML plus add a few better functionsThe app is www.apps.facebook.com/play-kenoLooking for a flat rate pr…,"Game Development, App Development",https://www.guru.com/jobs/facebook-game-app-from-flash-to-html/1632426&SearchUrl=search.aspx?
Joomla Developer for Maintenance,Lory B,on Feb 18,"Mar 19, 2020",Fixed Price or Hourly,"Requirements needed for this job.Joomla DeveloperFamiliar with Developing Joomla Website HTML, CSS CodingUpdating the Websites as we have 3.All Joomla Extensions including:AcymailingRsjoomlaWe will be…","HTML, CSS, Joomla, Email Support, Programming, Social Media Marketing, Web Development, Web Support, CRM, IT Service Management",https://www.guru.com/jobs/joomla-developer-for-maintenance/1632423&SearchUrl=search.aspx?
"Expert React Developer, Ongoing Project",Tom L,on Feb 18,"Mar 19, 2020","Hourly , No Rate specified , 30+ Hours/wk","We are looking for an expert React developer for an open-ended react developer role.You will be responsible for extending and changing our existing app’s features, along with comparable other react ap…","HTML, CSS, Bootstrap, React.js, ReactJS, Redux Framework",https://www.guru.com/jobs/expert-react-developer-ongoing-project/1632166&SearchUrl=search.aspx?
Sr. Mobile App Engineer (iOS):,Nova T,on Feb 12,"Apr 05, 2020",Fixed Price or Hourly,We are building an application for our online crypto-exchange and trade platform.We are looking for a candidate who can provide a professional quality of work.The Android and iOS/macOS apps are equall…,"Mobile Development, Objective C",https://www.guru.com/jobs/sr.-mobile-app-engineer-ios-/1630293&SearchUrl=search.aspx?
Sr. Mobile App Engineer (Android),Nova T,on Feb 11,"Apr 05, 2020",Fixed Price or Hourly,"The Android and iOS/macOS apps are equally important to us and we believe in the native experience, and that is what we want you to bring to our users.We try to use the best tools for the job:• Kotlin…",Android Development,https://www.guru.com/jobs/sr.-mobile-app-engineer-android-/1630103&SearchUrl=search.aspx?
Add new machines to existing app,Joe W,on Feb 07,"Mar 22, 2020","Hourly , Max $15 , 10-30 Hours/wk","Adding new machines to an existing app will require:-clean dirty IGS files in 3DS Max, save as FBX.-Import to Unity-Create UI for new machines-Create framework for new machines. Some existing code and…","3ds Max, C#, Unity 3D, Games",https://www.guru.com/jobs/add-new-machines-to-existing-app/1628917&SearchUrl=search.aspx?
"General IT Administrator, Updated",Torbett C,on Feb 02,"Apr 10, 2020",Fixed Price or Hourly,"Admin(cut off at end by guru, not enough space. can review more if need be in ur interest and response.)I hope it is detailed enough for your review. This is very critical to us, that we find a very q…","SSL, Magento, Web Support, IT Service Management",https://www.guru.com/jobs/general-it-administrator-updated/1627361&SearchUrl=search.aspx?
Setup Home page - Wordpress,Sunil V,on Jan 28,"Apr 24, 2020","Fixed Price , Under $250","I want to setup this (https://themeforest.net/item/tectxon-industry-factory-wordpress-theme/22457399)  theme as per this reference https://www.templatemonster.com/demo/62356.html So, Home page should be like reference and Multi language should be setup in backend.","HTML, WordPress, ThemeForest",https://www.guru.com/jobs/setup-home-page-wordpress/1625826&SearchUrl=search.aspx?
Need dot net full stack developer,preet s,on Jan 10,"Nov 30, 2020","Fixed Price , Under $250","I am looking for a developer with the following skillset  for a long term tie up-:Front End -: Angularjs, javascript, css, Reactjs, Redux, Backend-: C#, NodeJSDatabase-: SQL Server create table, views, procedurestools-: Swagger, Jenkins","JavaScript, CSS, SQL, C#, .NET, Microsoft SQL Server, Software Development, Full Stack, ReactJS, App & Mobile Programming Languages, Responsive & Hybrid",https://www.guru.com/jobs/need-dot-net-full-stack-developer/1620781&SearchUrl=search.aspx?
Frontend developer Angular 7/8 is a must,Nova T,on Nov 20,"Apr 05, 2020","Hourly , $18 - $22","ob Description:As a Sr. Front End Developer, you will be helping working a super star development team, implementing the vision helping millions of people around the globe. If you can do magic and cre…",Frontend Development,https://www.guru.com/jobs/frontend-developer-angular-7-8-is-a-must/1607071&SearchUrl=search.aspx?
front end web developer,Bilal T,on Nov 07,"Dec 07, 2019","Hourly , $5 - $20","Hello and welcome!I am a front-end web developer, with experience in UI & UX design. I use the latest web technologies HTML5, CSS3, SASS, Js, Bootstrap 4, etc, alongside with my Design skills to create responsive websites.","HTML, CSS, Design, Frontend Development, HTML5, Web Development, Bootstrap, UX / UI / Responsive",https://www.guru.com/jobs/front-end-web-developer/1603616&SearchUrl=search.aspx?
Attractive Mobile App using Android,Reshmi P,on Nov 01,"Apr 14, 2021",Fixed Price or Hourly,"Specialized in Mobile Application Development, I keep updated with the upcoming technology and apply the right technology to come up with a productive, cost-effective solution. Kindly have a look onto…","App Development, Mobile Development, Mobile App Development, App & Mobile Programming Languages, General / Other Apps & Mobile, Mobile Device Platforms, Responsive & Hybrid",https://www.guru.com/jobs/attractive-mobile-app-using-android/1601576&SearchUrl=search.aspx?
Designer for http://kickypie.com,Kicky P,on Feb 09,"Mar 30, 2023","Fixed Price , $1k-$2.5k",I need a front end designer to improve the flow and user experience. Must have developed similar sites. Please include portfolio.,CSS,https://www.guru.com/jobs/designer-for-http-kickypie.com/1433605&SearchUrl=search.aspx?
"Webdevelopment, webdesign",Floorplan D,on Jan 02,"Oct 21, 2032","Hourly , No Rate specified , 10-30 Hours/wk","We are looking for freelancers with focus on webdevelopment and webdesign.Must have for our projects:_____________________* PHP, MySql, modern HTML and CSS, JavaScript, jQuery, jQuery UI, XML, JSON, A…","PHP, MySQL, Ajax, JSON, jQuery",https://www.guru.com/jobs/webdevelopment-webdesign/1422412&SearchUrl=search.aspx?
Transcription Factor Binding Site (TFBS),Thomas H,on Mar 14,"Feb 01, 2025","Hourly , No Rate specified , 10-30 Hours/wk","Software Package for Transcription Factor Binding Site (TFBS) AnalysisI am looking for somebody, who can train me in using the Bioconductor R package with the name “TFBSTools”.  I would like to apply …",Bioinformatics,https://www.guru.com/jobs/transcription-factor-binding-site-tfbs-/1341004&SearchUrl=search.aspx?
